{
  "meta": {
    "task_id": "task-6f72f3a4fb25",
    "trace_id": "task-6f72f3a4fb25",
    "stage": "analysis",
    "generated_at": "2026-02-06T09:29:10.231324+00:00",
    "source_language": "COBOL",
    "target_language": null,
    "module": "UNKNOWN"
  },
  "unknowns": [
    {
      "field": "entry_points",
      "reason": "PROCEDURE から段落名を抽出できなかった"
    }
  ],
  "extensions": {
    "metadata": {
      "total_lines": 13,
      "parser": "PLY"
    }
  },
  "programs": [
    {
      "program_id": "HELLO-WORLD"
    }
  ],
  "entry_points": [],
  "io_contracts": [],
  "data_structures": [
    {
      "level": "01",
      "name": "WS-MESSAGE",
      "pic": "X(20)",
      "type": "string"
    }
  ],
  "control_flow": [],
  "db_access": [],
  "external_calls": []
}